Publication Date	Time	Author	Title	URL	Text
2021-10-28	19:01:07+00:00		The Cat Dad vs. the Vegan	https://www.nytimes.com/2021/10/27/opinion/local-election-mayor.html	As a subscriber, you have 10 gift articles to give each month. Anyone can read what you share. Guess I’m going for the vegan. Next week we’ll be voting in local elections all around the country. In New York the big contest is for mayor, and it pits Democrat Eric Adams against Republican Curtis Sliwa. Challenged to say something nice about Adams during the final mayoral debate on Tuesday night, Sliwa praised the Democrat’s vegan diet, adopted during a struggle against diabetes. Adams commended Sliwa on his kindness to animals. Sliwa and his wife are into sheltering abandoned cats, and they currently have 16 in their 320-square-foot studio apartment. I’ve got to admit this is the election factoid that has me most fascinated. The idea of vegan meals being served at Gracie Mansion is sort of interesting — bet we’d get more discussions of the menus than we ever got during Bill de Blasio’s long tenure. But how many cats could you fit in there? Dozens? Hundreds? OK, people — your turn. If you’ve got a mayoral election coming up in your town, tell me one interesting thing about a major candidate. Hey, there’s got to be something. If you’re still mulling, maybe you’re failing to focus. Keep thinking. We’ve still got … days. Do I see a hand over there in Connecticut? Yes, Stamford? You’ve got the former manager of the Mets running? And he called the Democratic candidate “a 35-year-old girl?” Wow, is he promising to make Stamford a municipal version of the Mets? Like residents of many cities, New Yorkers frequently feel as if their November vote is a tad anticlimactic. The real drama came in the Democratic primary — as the winner, Adams now enjoys a certain advantage that comes with being standard-bearer for a party with 3.7 million voters, compared with the Republicans’ 566,000. But we political junkies are hanging on until the bitter end. Still lots to gnaw over. Does everybody know that Sliwa’s been married four times and has two children from a long-running entanglement with the Queens district attorney? Meanwhile, where does Adams, a former police officer running on his promise to reform the city’s law enforcement culture, actually live? Brooklyn? New Jersey? His office? If we’re confused, Adams says it may be the fault of his having employed a homeless man to fill out his tax forms. OK, your turn to complain about your options. Yes, Minneapolis, I see your hand. You’re right: People who live in cities where the choice is basically between two names on the ballot should not be whining near folks who are going to have to pick from — my gosh, did you say 17? Indeed. Minneapolis has 17 candidates for mayor. The poor voters are supposed to go through the whole pile and pick a favorite, a runner-up and a third selection. This is called ranked-choice voting and it’s gotten very popular around the country. As the votes are counted, the biggest losers are tossed off and the people who picked them get their next choice put in the mix. The system has many advantages, but it does add one more responsibility to your good-citizen agenda. I remember being stuck at my Manhattan polling place, trying to imagine who my third-favorite candidate for comptroller might be … The Minneapolis election is theoretically nonpartisan but the candidates are allowed to give themselves a tag. Seven say they’re Democratic Farmer-Labor, which is going to give the voters quite a bit to scramble through, when they aren’t being distracted by the difference between the Independent, Independence Alliance and For the People parties. Or the self-declared nicknames, like Nate “Honey Badger” Atkins and Kevin “No Body” Ward. Another candidate calls himself Bob “Again” Carney Jr. and that’s a great reminder of how many times you’ve gone to vote, looked at the ballot and moaned, “Not again …” So, bottom line: big election doings coming on Tuesday. For your town, for your city and for all those candidates. Winning a job like mayor is certainly an opportunity to serve the community. And maybe it’s a political steppingstone to — what? A. Being elected president B. Being elected mayor again C. Being indicted Well, only three American mayors have ever gone on to the White House, and the last of those was Calvin Coolidge. As far as lengthy tenure goes, lots of towns now have term limits, but for those that don’t, the sky’s the limit. (By the way, feel free to congratulate Robert Blais of Lake George, N.Y., on his 50th anniversary as village mayor. Blais, 85, recently told a local paper that he was leaning heavily toward retirement a couple of years down the line.) On the indictment front, I noticed that a leading candidate for mayor in the upcoming Cincinnati election had his campaign sidetracked when he was charged with accepting bribes last November. Certainly sounds like time for a change, but observers are noting that the Cincinnati electorate seems a little, um, detached. “Does anyone care, including the candidates themselves?” demanded a local columnist. Well, you can understand why the voters might be a tad depressed, given that a third of the City Council has been arrested on charges like bribery and extortion. But really, citizens, this is exactly the time you have to put on your boots and march over to the polling places, demonstrating that you’re paying attention and want to turn things around. Really, it’ll perk up your day. Even if it’s raining. The Times is committed to publishing a diversity of letters to the editor. We’d like to hear what you think about this or any of our articles. Here are some tips. And here’s our email: letters@nytimes.com. Follow The New York Times Opinion section on Facebook, Twitter (@NYTopinion) and Instagram.
2021-10-28	13:05:47+00:00		Nabati Foods Expand Listings with Vegan eCommerce site GTFO It’s Vegan	https://financialpost.com/globe-newswire/nabati-foods-expand-listings-with-vegan-ecommerce-site-gtfo-its-vegan	 Nabati Cheeze Shreds, plant-based meats, and Nabati Plant Eggz™ have been added to the online retailer’s listings VANCOUVER, British Columbia, Oct. 28, 2021 (GLOBE NEWSWIRE) — Nabati Foods Global Inc. ( CSE: MEAL ) ( FSE:7UW ) (“ Nabati Foods ” or the “ Company ”), a plant-based food technology company offering whole, natural, plant-based foods for health-conscious consumers, is announcing its Nabati Cheeze Shreds, Nabati Plant Eggz™, and its plant-based Chick’n and F’sh Burgers are now available via online retailer GTFO It’s Vegan. GTFO It’s Vegan launched in the Spring 2020 and offers more than 2,500 vegan food, home goods, drinks, and pet products. Several Nabati Foods products are now available on the site including chocolate and tiramisu cheesecakes, Nabati Cheeze Shreds in both mozzarella and cheddar flavors, Nabati Plant Eggz™, Nabati F’sh Burgers, and Chick’n Burgers. “Expanding our distribution online with a growing eCommerce platform like GTFO It’s Vegan is a great way for us to get Nabati Foods products in front of a wider audience of like-minded customers,” said Ahmad Yehya, CEO of Nabati Foods. “GTFO It’s Vegan, similar to Nabati Foods, is a family-founded company, which makes this partnership particularly meaningful for us.” All Nabati Foods products are kosher, vegan, egg-free, dairy-free, gluten-free, and made without GMOs or refined sugar. “Nabati Foods is dedicated to the idea that healthy food can be delicious, and we’ve set out to prove that theory with our plant-based eggs, meats, desserts, and cheeses,” added Yehya. “There is a Nabati Foods recipe that works for every meal of the day, breakfast, lunch, dinner, and dessert. We are committed to making it easy for our customers to integrate healthy, sustainable meals and ingredients into their lives.” Subscribe to updates about Nabati Foods here: https://invest.nabatifoods.com/ About Nabati Foods Global Inc. Nabati Foods Global Inc. is the owner of Nabati Foods Inc. (“Nabati Foods”), a family-founded food technology company offering whole, natural, plant-based, gluten, and soy-free foods for health-conscious consumers. Nabati Foods was founded in 2014 and has four signature product lines including dairy-free cheesecakes, cheese alternatives, plant-based meats, and a plant-based liquid egg alternative. Nabati Foods products are distributed throughout Canada, the U.S., and internationally through eCommerce, grocery, foodservice, and industrial channels. Learn more: https://invest.nabatifoods.com/ For investor inquiries or further information, please contact: ir@nabatifoods.com For media inquiries, please contact: Brittany@Exvera.com Find Nabati on Social Media: on Instagram , Facebook , Twitter and LinkedIn No securities regulatory authority has either approved or disapproved of the contents of this news release. This news release does not constitute an offer to sell or a solicitation of an offer to buy any securities of Nabati in any jurisdiction in which such offer, solicitation or sale would be unlawful. The securities have not been and will not be registered under the United States Securities Act of 1933, as amended (the “ U.S. Securities Act “), or any state securities laws. Accordingly, the securities may not be offered or sold within the U.S. or to U.S. persons (as defined in Regulation S under the U.S. Securities Act) unless registered under the U.S. Securities Act and applicable state securities laws, or pursuant to exemptions from the registration requirements of the U.S. Securities Act and applicable state securities laws. This news release includes certain forward-looking statements and forward-looking information (collectively, “ forward-looking statements “) within the meaning of applicable Canadian securities legislation. The use of any of the words “expect”, “anticipate”, “continue”, “estimate”, “objective”, “may”, “will”, “project”, “should”, “believe”, “plans”, “intends” and similar expressions are intended to identify forward-looking information or statements. The forward-looking statements and information are based on certain key expectations and assumptions made by the Company. Although the Company believes that the expectations and assumptions on which such forward-looking statements and information are based are reasonable, undue reliance should not be placed on the forward-looking statements and information because the Company can give no assurance that they will prove to be correct. Since forward-looking statements and information address future events and conditions, by their very nature they involve inherent risks and uncertainties. Forward-looking information in this news release includes statements concerning the Company’s general business plans. Actual results could differ materially from those currently anticipated due to a number of factors and risks. Factors that could materially affect such forward-looking information are described in the risk factors in the Final Prospectus, and the schedules attached thereto, that are available on the Company’s profile on SEDAR at www.sedar.com . Readers are cautioned that the foregoing list of factors is not exhaustive. The forward-looking statements included in this news release are expressly qualified by this cautionary statement. The forward-looking statements and information contained in this news release are made as of the date hereof and the Company undertakes no obligation to update publicly or revise any forward-looking statements or information, whether as a result of new information, future events or otherwise, unless so required by applicable laws. Sign up to receive the daily top stories from the Financial Post, a division of Postmedia Network Inc. A welcome email is on its way. If you don't see it, please check your junk folder. The next issue of Financial Post Top Stories will soon be in your inbox. We encountered an issue signing you up. Please try again Postmedia is committed to maintaining a lively but civil forum for discussion and encourage all readers to share their views on our articles. Comments may take up to an hour for moderation before appearing on the site. We ask you to keep your comments relevant and respectful. We have enabled email notifications—you will now receive an email if you receive a reply to your comment, there is an update to a comment thread you follow or if a user you follow comments. Visit our Community Guidelines for more information and details on how to adjust your email settings. 
2021-10-28	12:57:40+00:00	By													Victoria Giardina																																										Social Links for Victoria Giardina																												View Author Archive										email the author										Get author RSS feed																																																														Contact The AuthorName(required)	Email(required)	Comment(required)				Submit	Shop the 20 best pieces from M.M.LaFleur’s 20% off sale: jackets and more	https://nypost.com/2021/10/28/the-20-best-pieces-from-m-m-lafleurs-20-off-sale/	 Thanks for contacting us. We've received your submission. NY Post may be compensated and/or receive an affiliate commission if you buy through our links. There’s never been a better time for a luxury fashion stock up. Ahead of the brand’s Black Friday deals, M.M.LaFleur is hosting its first-ever sitewide sale available now, featuring 20% off full-priced favorites like the Alphonso Vegan Leather Jacket, the Nene Slip Dress and plush cashmere Lea Sweater, among other quality styles. Just use code TREATSONLY to score the savings. We adore its back-to-office collection that took prominence in the brand’s Fall 2021 Collection. That said, if you’re on the hunt for brand-new workwear, your new holiday dinner outfit or a luxe offering to gift to your BFF, M.M.LaFleur has you covered. And, if you have a super keen eye on your who-to-shop-for wishlist, it’s the perfect time to add holiday gifts to your cart. After all, who doesn’t love some good candles, cashmere socks and coasters? Ahead, find our 20 favorite pieces from M.M.LaFleur’s 20% sitewide sale. And hurry, your favorite lush and plush selects are only available until Sunday, Oct. 31. It’s not fall if you don’t splurge on a cashmere sweater — right? I recently styled The Arbus Sweater with a pair of darkwash denim jeans and black suede boots and it was perfect for a family dinner. Cashmere isn’t limited to sweaters this season. Shop The Freya Hoodie that’s the most decadent cashmere and wool blend we’ve seen in the luxe loungwear game. We may be approaching winter, but we’re still all about the camis. As the perfect chic layering piece, The Lisey Cami is one to invest in during the 20% off sale. For a perfect heeled boot option, you can’t go wrong with The Zelda Boot. They’re an investment but worth it — especially when paired with M.M.LaFleur’s Lilia Jacket. Sure, cashmere sweaters may be on your shopping list. But, cashmere gloves to pair with them? Unbeatable. The Circle Cable Gloves are the ideal wear for trips to NYC, an evening dinner or en route to a holiday dinner. And, they make for a great stocking stuffer. Meet my favorite work pants of all time. Nothing beats M.M.LaFleur’s flattering Zhou Culotte, especially when paired with a fall sweater and ballet flats. Fulfull your wanderlust (or someone else’s) with this chic Passport Holder. Made from fine Italian leather, it’s luxurious and practical to snag this season. As one of M.M.LaFleur’s bestsellers, The Hockey Jean is made from Turkish two-way stretch cotton that hugs you in all the right places. Plus, there’s a concealed snap hem for a seamless fit. The Dae Top is a gorgeous off-the-shoulder style that pairs well with any type of work pant or jeans. It truly has a “wow factor” with a softer-than-butter feel and fit. Talk about a versatile dress. The Emily Dress is fit for fancy and casual occasions alike. Plus, it’s quater-length sleeves and relaxed yet structured wear is something we can’t get over. Diffusers are one of the most painless ways to freshen up your room — no flames required. The Passport Diffuser offers notes of cypress, juniper and sandalwood for a clean and mature scent. Elevate your basics this season with The Soyoung Shirt — one of M.M.LaFleur’s more affordable options with a slimming fit, open neckline and easy-to-tuck bodice. On the hunt for a good outwear staple? The Clark Puffer is a sharp-looking option that has cozy yet lightweight AirTech fabric. Plus, the cinched belt is to die for. Turn heads with The Frida Earrings — the pair that seems to be eclectic, traditional and modern all at once. Half-zips are tops to live in during winter, so invest in a high-end option like The Athens Half Zip. Knit in structured yet stretchy yarn, the mock neck and slightly oversized cut makes it one you’ll wear for years. The Cortlandt Skirt ensures you’re showing up to work in style with a subtle slit, fits-like-a-glove fit and versatile, classic look. Plus, it looks great with a bodysuit and blazer. For a wellness gift idea, look into The Know Yourself Better Journal. According to M.M.LaFleur, you’ll “develop self-compassion and understanding and discover ways you might make your life a little happier.” Stay warm and cozy with The Addison Jogger. In a rich cashmere and wool blend, it’s comfortable for WFH days and stylish for running errands. Did someone say holiday party? The Rowling Top has the most gorgeous neckline we’ve ever seen and is versatile to wear to an evening dinner and office meeting. Invest in quality slip-ons with The Grace Loafer. Crafted with embossed croc, the pair is a textured beaut to add to your collection. Check out New York Post Shopping for more content.
2021-10-28	11:31:11+00:00	MarketScreener	Odd Burger Set to Expand to 10 Locations with New Ontario Restaurants in Brampton and Whitby	https://www.marketscreener.com/quote/stock/ODD-BURGER-CORPORATION-124221539/news/Odd-Burger-Set-to-Expand-to-10-Locations-with-New-Ontario-Restaurants-in-Brampton-and-Whitby-36812632/?utm_medium=RSS&utm_content=20211028	
2021-10-28	09:59:02+00:00	MarketScreener	Rosalita Life : Nhiär: Sensual vegan chocolate, reimagined	https://www.marketscreener.com/news/latest/Rosalita-Life-Nhiar-Sensual-vegan-chocolate-reimagined--36810676/?utm_medium=RSS&utm_content=20211028	
2021-10-28	09:59:02+00:00	MarketScreener	Rosalita Life : Nhiär: Sensual vegan chocolate, reimagined	https://www.marketscreener.com/news/latest/Rosalita-Life-Nhiar-Sensual-vegan-chocolate-reimagined--36810677/?utm_medium=RSS&utm_content=20211028	
2021-10-27	22:10:42+00:00		Sugar Taco and Daring Team Up to Serve Tacos Across L.A. – For Free!	https://www.laweekly.com/sugar-taco-and-daring-team-up-to-serve-tacos-across-l-a-for-free/	Los Angeles residents are in for a very special Halloween treat – this week, Sugar Taco and Daring are teaming up to serve food all over the city … FOR FREE! We’re excited to share that Sugar Taco, the wildly popular vegan Mexican restaurant in Los Angeles and Sherman Oaks, has partnered with Daring Foods, the leading plant-based chicken brand, founded with the mission of removing chicken from the global food system, for a limited-time menu item. Sugar Taco was cofounded by Jayde Nicole and is both run and funded by women, including backers Alicia Silverstone, Daniela Monet, Lindsey Pelas and myself. Daring Foods, notably backed by celebrities Drake and celebrated DJ and producer Kygo, is known for its innovative plant-based chicken pieces. Daring Foods and Sugar Taco are excited to demonstrate the versatility of Daring Foods plant-based chicken with tasty new dishes. At both Los Angeles locations, Sugar Taco debuts a limited-time Fried Chicken Taco, featuring Daring’s popular Original Breaded pieces that are fried and topped with a tangy lime slaw and pickled jalapeños. In celebration of the launch, Daring and Sugar Taco are also debuting a food truck that will be serving up these delicious tacos as well as nachos, all across Los Angeles for free! Wednesday, October 27 Hollywood / Highland 1915 N. Highland Ave, Los Angeles, CA 4 p.m. – 10 p.m. Thursday, October 28 West Hollywood 7452 Melrose Ave, Los Angeles, CA 1 p.m. – 9 p.m. Friday, October 29 Santa Monica Mall 395 Santa Monica Place 11 a.m. – 5 p.m. Staples Center 11th & Chickhearn Circle 6 p.m. – 9 p.m. Saturday, October 30 The Brig 1515 Abbot Kinney Blvd, Venice, CA 11 a.m. – 3 p.m. The Palladium 6215 Sunset Blvd, Los Angeles, CA 5 p.m. – 9p.m. Sunday, October 31 Melrose Trading Post 7850 Melrose Ave, Los Angele, CA 10 a.m. – 4 p.m. Cookies & Kicks 7452 Melrose Ave, Los Angeles, CA 5 p.m. – 8 p.m.
2021-10-27	20:03:02+00:00	MarketScreener	Mo's House of Axe: New BBQ Menu, Drink Specials and Halloween Events	https://www.marketscreener.com/news/latest/Mo-s-House-of-Axe-New-BBQ-Menu-Drink-Specials-and-Halloween-Events--36803816/?utm_medium=RSS&utm_content=20211027	
2021-10-27	15:58:15+00:00	MarketScreener	30 VEGAN HALLOWEEN CANDIES (AND OTHER TREATS) WE FOUND AT TARGET	https://www.marketscreener.com/quote/stock/HORMEL-FOODS-CORPORATION-12977/news/30-VEGAN-HALLOWEEN-CANDIES-AND-OTHER-TREATS-WE-FOUND-AT-TARGET-36802390/?utm_medium=RSS&utm_content=20211027	
